title,department,location,posting_date,remote,region,url
"Baltimore MD, Territory Account Executive",Sales,"Baltimore, Maryland, United States",Not specified,No,Not specified,https://careers.toasttab.com/jobs/baltimore-md-territory-account-executive-baltimore-maryland-united-states
Corporate Development Deal Lead,Finance,"Boston, Massachusetts, United States",Not specified,No,Not specified,https://careers.toasttab.com/jobs/corporate-development-deal-lead-boston-massachusetts-united-states
Customer Care Tax Expert,Customer Success,"Remote, United States",Not specified,Yes,Not specified,https://careers.toasttab.com/jobs/customer-care-tax-expert-remote-united-states
Flex (Mid Atlantic Region) Territory Account Executive,Sales,"Washington, District of Columbia, United States",Not specified,No,Not specified,https://careers.toasttab.com/jobs/flex-mid-atlantic-region-territory-account-executive-washington-district-of-columbia-united-states
Flex Growth Account Executive,Sales,"Charlotte, North Carolina, United States",Not specified,No,Not specified,https://careers.toasttab.com/jobs/flex-growth-account-executive-charlotte-north-carolina-united-states
"Growth Account Executive- Charlotte, NC",Sales,"Charlotte, North Carolina, United States",Not specified,No,Not specified,https://careers.toasttab.com/jobs/growth-account-executive-charlotte-nc-charlotte-north-carolina-united-states
"Growth Account Executive- Greensboro, NC",Sales,"Greensboro, North Carolina, United States",Not specified,No,Not specified,https://careers.toasttab.com/jobs/growth-account-executive-greensboro-nc-greensboro-north-carolina-united-states
Growth Flex Account Executive,Sales,"San Diego, California, United States",Not specified,No,Not specified,https://careers.toasttab.com/jobs/growth-flex-account-executive-san-diego-california-united-states
Growth Flex Account Executive,Sales,"Phoenix, Arizona, United States",Not specified,No,Not specified,https://careers.toasttab.com/jobs/growth-flex-account-executive-phoenix-arizona-united-states
"Jacksonville, FL Territory Account Executive",Sales,"Jacksonville, Florida, United States",Not specified,No,Not specified,https://careers.toasttab.com/jobs/jacksonville-fl-territory-account-executive-jacksonville-florida-united-states-dfb03644-b1d9-4a91-9557-e9a1df8cb30c
"Kissimmee FL, Territory Account Executive (Strategic Markets)",Sales,"Kissimmee, Florida, United States",Not specified,No,Not specified,https://careers.toasttab.com/jobs/kissimmee-fl-territory-account-executive-strategic-markets-kissimmee-florida-united-states
"Senior Customer Success Manager I, RMM",Customer Success,,Not specified,No,Not specified,https://careers.toasttab.com/jobs/senior-customer-success-manager-i-rmm
"Senior Manager, Revenue Accounting",Finance,"Chennai, Tamil Nadu, India",Not specified,No,Not specified,https://careers.toasttab.com/jobs/senior-manager-revenue-accounting-chennai-tamil-nadu-india
"Senior Product Manager, Enterprise Systems",Enterprise Tech,"Remote, United States",Not specified,Yes,Not specified,https://careers.toasttab.com/jobs/senior-product-manager-enterprise-systems-remote-united-states
Senior Revenue Accounting Manager,Finance,"Remote, United States",Not specified,Yes,Not specified,https://careers.toasttab.com/jobs/senior-revenue-accounting-manager-remote-united-states
Senior Salesforce Developer,Enterprise Tech,"Bengaluru, Karnataka, India",Not specified,No,Not specified,https://careers.toasttab.com/jobs/senior-salesforce-developer-bengaluru-karnataka-india-93df9542-7f1d-401b-b2c7-80db79063ad7
"South Charlotte, NC Territory Account Executive",Sales,"Charlotte, North Carolina, United States",Not specified,No,Not specified,https://careers.toasttab.com/jobs/south-charlotte-nc-territory-account-executive-charlotte-north-carolina-united-states
"Territory Account Executive, SMB - San Francisco, CA",Sales,"San Francisco, California, United States",Not specified,No,Not specified,https://careers.toasttab.com/jobs/territory-account-executive-smb-san-francisco-ca-san-francisco-california-united-states-ac9b484a-a5fe-4a6b-b14d-c624209d1c3e
"Territory Account Executive, SMB - Tacoma, WA",Sales,"Tacoma, Washington, United States",Not specified,No,Not specified,https://careers.toasttab.com/jobs/territory-account-executive-smb-tacoma-wa-tacoma-washington-united-states
Zuora Admin,Enterprise Tech,"Bengaluru, Karnataka, India",Not specified,No,Not specified,https://careers.toasttab.com/jobs/zuora-admin-bengaluru-karnataka-india
