title,department,location,posting_date,remote,region,url
"Counsel, Partnerships & Commerce",Legal,"New York, United States",Not specified,No,Not specified,https://careers.toasttab.com/jobs/counsel-partnerships-commerce-new-york-united-states
"Counsel, Partnerships & Commerce",Legal,"Boston, Massachusetts, United States",Not specified,No,Not specified,https://careers.toasttab.com/jobs/counsel-partnerships-commerce-boston-massachusetts-united-states
Enterprise Business Development Representative,Sales,"Boston, Massachusetts, United States",Not specified,No,Not specified,https://careers.toasttab.com/jobs/enterprise-business-development-representative-boston-massachusetts-united-states-04784022-7d33-4df5-a001-16bc64929d02
Flex Growth Account Executive,Sales,"Atlanta, Georgia, United States",Not specified,No,Not specified,https://careers.toasttab.com/jobs/flex-growth-account-executive-atlanta-georgia-united-states-1dc7037e-f554-4b75-809f-8d581407aa5a
Flex Growth Account Executive,Sales,"Chicago, Illinois, United States",Not specified,No,Not specified,https://careers.toasttab.com/jobs/flex-growth-account-executive-chicago-illinois-united-states-939fd34b-914f-4074-95df-80143d39eafc
"Growth Account Executive - Dallas, TX",Sales,"Dallas, Texas, United States",Not specified,No,Not specified,https://careers.toasttab.com/jobs/growth-account-executive-dallas-tx-dallas-texas-united-states
Growth Flex Account Executive,Sales,"San Diego, California, United States",Not specified,No,Not specified,https://careers.toasttab.com/jobs/growth-flex-account-executive-san-diego-california-united-states
Growth Flex Account Executive,Sales,"Phoenix, Arizona, United States",Not specified,No,Not specified,https://careers.toasttab.com/jobs/growth-flex-account-executive-phoenix-arizona-united-states
Inside Sales Executive,Sales,,Not specified,No,Not specified,https://careers.toasttab.com/jobs/inside-sales-executive-336b8ccd-95a3-4b1d-804a-9b3e9649363e
"Los Angeles, CA Hyperlocal Territory Account Executive",Sales,"Los Angeles, California, United States",Not specified,No,Not specified,https://careers.toasttab.com/jobs/los-angeles-ca-hyperlocal-territory-account-executive-los-angeles-california-united-states
"Manager II, Customer Care Tax",Customer Success,"Remote, United States",Not specified,Yes,Not specified,https://careers.toasttab.com/jobs/manager-ii-customer-care-tax-remote-united-states
Product Analyst,Product,"Remote, United States",Not specified,Yes,Not specified,https://careers.toasttab.com/jobs/product-analyst-remote-united-states-6947f87a-ad75-4e64-af00-c49aa930d6b9
"Product Designer, Guest",Design,"Dublin, County Dublin, Ireland",Not specified,No,Not specified,https://careers.toasttab.com/jobs/product-designer-guest-dublin-county-dublin-ireland
Retail Account Executive - Albany,Sales,"Albany, New York, United States",Not specified,No,Not specified,https://careers.toasttab.com/jobs/retail-account-executive-albany-albany-new-york-united-states
Retail Account Executive - Kingston,Sales,"Kingston, New York, United States",Not specified,No,Not specified,https://careers.toasttab.com/jobs/retail-account-executive-kingston-kingston-new-york-united-states
"Senior Associate Retail, Event Marketing",Marketing,,Not specified,No,Not specified,https://careers.toasttab.com/jobs/senior-associate-retail-event-marketing
"Senior Associate, Strategic Finance",Finance,"San Francisco, California, United States",Not specified,No,Not specified,https://careers.toasttab.com/jobs/senior-associate-strategic-finance-san-francisco-california-united-states-a86fcfb0-ddb0-4317-b9cc-0fbde87747aa
"Senior Associate, Strategic Finance",Finance,"Boston, Massachusetts, United States",Not specified,No,Not specified,https://careers.toasttab.com/jobs/senior-associate-strategic-finance-boston-massachusetts-united-states-623275ec-583a-46ba-80e3-585ed11f28de
Staff Software Engineer,Engineering,"Boston, Massachusetts, United States",Not specified,No,Not specified,https://careers.toasttab.com/jobs/staff-software-engineer-boston-massachusetts-united-states-5199793f-91c2-4bfa-84ad-fda905c8e641
