title,department,location,posting_date,remote,region,url
"Senior Engineering Manager, Data Science",Engineering,"Remote, United States",Not specified,Yes,Not specified,https://careers.toasttab.com/jobs/senior-engineering-manager-data-science-remote-united-states
Bilingual Hindi Strategic Cuisines Account Executive,Sales,,Not specified,No,Not specified,https://careers.toasttab.com/jobs/bilingual-hindi-strategic-cuisines-account-executive
Bilingual Thai Strategic Cuisines Account Executive,Sales,"Texas, United States",Not specified,No,Not specified,https://careers.toasttab.com/jobs/bilingual-thai-strategic-cuisines-account-executive-texas-united-states
"Coral Springs, FL Territory Account Executive",Sales,"Coral Springs, Florida, United States",Not specified,No,Not specified,https://careers.toasttab.com/jobs/coral-springs-fl-territory-account-executive-coral-springs-florida-united-states
Credit Risk Senior Analyst,Fintech,"Bengaluru, Karnataka, India",Not specified,No,Not specified,https://careers.toasttab.com/jobs/credit-risk-senior-analyst-bengaluru-karnataka-india
"Director - People Operations, Shared Services",People & Places,"Chennai, Tamil Nadu, India",Not specified,No,Not specified,https://careers.toasttab.com/jobs/director-people-operations-shared-services-chennai-tamil-nadu-india
"Director, Care Analytics",Customer Success,"Boston, Massachusetts, United States",Not specified,No,Not specified,https://careers.toasttab.com/jobs/director-care-analytics-boston-massachusetts-united-states
"Director, Data Engineering & Infrastructure (Customer Success)",Customer Success,"Boston, Massachusetts, United States",Not specified,No,Not specified,https://careers.toasttab.com/jobs/director-data-engineering-infrastructure-customer-success-boston-massachusetts-united-states
"East Bay, CA Territory Account Executive",Sales,"California, United States",Not specified,No,Not specified,https://careers.toasttab.com/jobs/east-bay-ca-territory-account-executive-california-united-states-ea5bd119-1813-4d19-9bad-4fa91bb654a0
Equity Analyst,People & Places,"Chennai, Tamil Nadu, India",Not specified,No,Not specified,https://careers.toasttab.com/jobs/equity-analyst-chennai-tamil-nadu-india
"Flex Strategic Cuisine Territory Account Executive (Spanish/Bilingual)-East Coast, USA",Sales,"Long Island, New York, United States",Not specified,No,Not specified,https://careers.toasttab.com/jobs/flex-strategic-cuisine-territory-account-executive-spanish-bilingual-east-coast-usa-long-island-new-york-united-states
"Growth Account Executive- Charlotte, NC",Sales,"Charlotte, North Carolina, United States",Not specified,No,Not specified,https://careers.toasttab.com/jobs/growth-account-executive-charlotte-nc-charlotte-north-carolina-united-states
"Growth Account Executive- Dallas, TX",Sales,"Dallas, Texas, United States",Not specified,No,Not specified,https://careers.toasttab.com/jobs/growth-account-executive-dallas-tx-dallas-texas-united-states
"Growth Account Executive- Greensboro, NC",Sales,"Greensboro, North Carolina, United States",Not specified,No,Not specified,https://careers.toasttab.com/jobs/growth-account-executive-greensboro-nc-greensboro-north-carolina-united-states
"Growth Account Executive- Pittsburgh, PA",Sales,"Pittsburgh, Pennsylvania, United States",Not specified,No,Not specified,https://careers.toasttab.com/jobs/growth-account-executive-pittsburgh-pa-pittsburgh-pennsylvania-united-states
Hybrid Development Representative,Sales,"Jersey City, New Jersey, United States",Not specified,No,Not specified,https://careers.toasttab.com/jobs/hybrid-development-representative-jersey-city-new-jersey-united-states
Hybrid Development Representative,Sales,"Philadelphia, Pennsylvania, United States",Not specified,No,Not specified,https://careers.toasttab.com/jobs/hybrid-development-representative-philadelphia-pennsylvania-united-states
Hybrid Development Representative,Sales,"Cleveland, Ohio, United States",Not specified,No,Not specified,https://careers.toasttab.com/jobs/hybrid-development-representative-cleveland-ohio-united-states
Hybrid Development Representative,Sales,"Cincinnati, Ohio, United States",Not specified,No,Not specified,https://careers.toasttab.com/jobs/hybrid-development-representative-cincinnati-ohio-united-states
Hybrid Development Representative,Sales,"Columbus, Ohio, United States",Not specified,No,Not specified,https://careers.toasttab.com/jobs/hybrid-development-representative-columbus-ohio-united-states
"Jacksonville, FL Territory Account Executive",Sales,"Jacksonville, Florida, United States",Not specified,No,Not specified,https://careers.toasttab.com/jobs/jacksonville-fl-territory-account-executive-jacksonville-florida-united-states-701261cf-001d-46ac-b20a-67229952bd15
Lead Fraud & Risk Strategy Analyst,Fintech,"Bangalore, India",Not specified,No,Not specified,https://careers.toasttab.com/jobs/lead-fraud-risk-strategy-analyst
Manager II - Customer Care - Enterprise,Customer Success,"Omaha, Nebraska, United States",Not specified,No,Not specified,https://careers.toasttab.com/jobs/manager-ii-customer-care-enterprise-omaha-nebraska-united-states-1aee1cf4-21a6-4831-a262-2d79e7de92b9
"Mandarin Bilingual San Francisco, CA Territory Account Executive",Sales,"San Francisco, California, United States",Not specified,No,Not specified,https://careers.toasttab.com/jobs/mandarin-bilingual-san-francisco-ca-territory-account-executive-san-francisco-california-united-states-ab9564fc-d12a-4afb-8f28-f9cb5fe33a55
"Napa Valley, CA Territory Account Executive",Sales,"Napa County, California, United States",Not specified,No,Not specified,https://careers.toasttab.com/jobs/napa-valley-ca-territory-account-executive-napa-county-california-united-states
North Atlantic Flex Account Executive,Sales,"Philadelphia, Pennsylvania, United States",Not specified,No,Not specified,https://careers.toasttab.com/jobs/north-atlantic-flex-account-executive-philadelphia-pennsylvania-united-states
Principal Software Engineer,,"Dublin, County Dublin, Ireland",Not specified,No,Not specified,https://careers.toasttab.com/jobs/principal-software-engineer-dublin-county-dublin-ireland-5615e2dd-9e55-4f1f-876e-5f0110bad5b2
Principal Technical Architect - HR Ecosystem,People & Places,"Chennai, Tamil Nadu, India",Not specified,No,Not specified,https://careers.toasttab.com/jobs/principal-technical-architect-hr-ecosystem-chennai-tamil-nadu-india
"Retail Account Executive - Augusta, GA",Sales,"Augusta, Georgia, United States",Not specified,No,Not specified,https://careers.toasttab.com/jobs/retail-account-executive-augusta-ga-augusta-georgia-united-states
Retail Account Executive - East CT,Sales,"Windham, Connecticut, United States",Not specified,No,Not specified,https://careers.toasttab.com/jobs/retail-account-executive-east-ct-windham-connecticut-united-states
Retail Account Executive - East CT,Sales,"New Haven, Connecticut, United States",Not specified,No,Not specified,https://careers.toasttab.com/jobs/retail-account-executive-east-ct-new-haven-connecticut-united-states
Retail Account Executive - Poughkeepsie,Sales,"Poughkeepsie, New York, United States",Not specified,No,Not specified,https://careers.toasttab.com/jobs/retail-account-executive-poughkeepsie-poughkeepsie-new-york-united-states
"Sacramento, CA Spanish Bilingual Account Executive",Sales,"Sacramento, California, United States",Not specified,No,Not specified,https://careers.toasttab.com/jobs/sacramento-ca-spanish-bilingual-account-executive-sacramento-california-united-states
"Sacramento, CA Territory Account Executive",Sales,"Sacramento, California, United States",Not specified,No,Not specified,https://careers.toasttab.com/jobs/sacramento-ca-territory-account-executive-sacramento-california-united-states-bf28ebe7-2b25-4a39-8eda-cc047b6c9e2d
"San Jose, CA Territory Account Executive",Sales,"San Jose, California, United States",Not specified,No,Not specified,https://careers.toasttab.com/jobs/san-jose-ca-territory-account-executive-san-jose-california-united-states-4a786cdb-3f98-4537-9440-c17986ee0979
Senior Accounts Payable Specialist,Finance,"Chennai, Tamil Nadu, India",Not specified,No,Not specified,https://careers.toasttab.com/jobs/senior-accounts-payable-specialist-chennai-tamil-nadu-india
Senior Data Scientist,Engineering,"Remote, United States",Not specified,Yes,Not specified,https://careers.toasttab.com/jobs/senior-data-scientist-remote-united-states-a1a62cad-7618-4704-ad3f-cedf8f3fab1a
"Senior Manager, Payments Optimization",Fintech,United States,Not specified,No,Not specified,https://careers.toasttab.com/jobs/senior-manager-payments-optimization-united-states
Senior Product Analyst,Product,"Remote, United States",Not specified,Yes,Not specified,https://careers.toasttab.com/jobs/senior-product-analyst-remote-united-states
"Senior Product Designer, Platform",Design,Canada,Not specified,No,Not specified,https://careers.toasttab.com/jobs/senior-product-designer-platform-canada
"Senior Product Designer, Sales Experiences",Enterprise Tech,"Remote, United States",Not specified,Yes,Not specified,https://careers.toasttab.com/jobs/senior-product-designer-sales-experiences-remote-united-states
"Senior Systems Engineer, Salesforce",Enterprise Tech,"Bengaluru, Karnataka, India",Not specified,No,Not specified,https://careers.toasttab.com/jobs/senior-systems-engineer-salesforce-bengaluru-karnataka-india
Software Engineer II - MLOps,Engineering,"Bengaluru, Karnataka, India",Not specified,No,Not specified,https://careers.toasttab.com/jobs/software-engineer-ii-mlops-bengaluru-karnataka-india
Software Engineer II- Funds Management,Engineering,"Dublin, County Dublin, Ireland",Not specified,No,Not specified,https://careers.toasttab.com/jobs/software-engineer-ii-funds-management-dublin-county-dublin-ireland
Spanish Bilingual Territory Account Executive- LA,Sales,"Los Angeles, California, United States",Not specified,No,Not specified,https://careers.toasttab.com/jobs/spanish-bilingual-territory-account-executive-la-los-angeles-california-united-states
Staff Data Scientist,Engineering,"Remote, United States",Not specified,Yes,Not specified,https://careers.toasttab.com/jobs/staff-data-scientist-remote-united-states-cfa3f35f-e9e9-458e-a6f4-0bd00c73140c
"Strategic Cuisines Account Executive, Spanish - Dallas",Sales,"Dallas, Texas, United States",Not specified,No,Not specified,https://careers.toasttab.com/jobs/strategic-cuisines-account-executive-spanish-dallas-dallas-texas-united-states
Territory Account Executive,Sales,"Allentown, Pennsylvania, United States",Not specified,No,Not specified,https://careers.toasttab.com/jobs/territory-account-executive-allentown-pennsylvania-united-states
"Territory Account Executive, Retail - SW Illinois",Sales,"St. Louis, Missouri, United States",Not specified,No,Not specified,https://careers.toasttab.com/jobs/territory-account-executive-retail-sw-illinois-st-louis-missouri-united-states
"West Orlando, FL Territory Account Executive",Sales,"Orlando, Florida, United States",Not specified,No,Not specified,https://careers.toasttab.com/jobs/west-orlando-fl-territory-account-executive-orlando-florida-united-states
