title,department,location,posting_date,remote,region,url
"Cleveland, OH Territory Account Executive",Sales,"Cleveland, Ohio, United States",Not specified,No,Not specified,https://careers.toasttab.com/jobs/cleveland-oh-territory-account-executive-cleveland-ohio-united-states-190cda31-9820-4021-aae9-755fdd524f6a
Mandarin Strategic Cuisines Inside Account Executive,Sales,"Chicago, Illinois, United States",Not specified,No,Not specified,https://careers.toasttab.com/jobs/mandarin-strategic-cuisines-inside-account-executive-chicago-illinois-united-states
"(Dallas, TX) Customer Success Manager II, SMB - Dedicated",Customer Success,"Dallas, Texas, United States",Not specified,No,Not specified,https://careers.toasttab.com/jobs/dallas-tx-customer-success-manager-ii-smb-dedicated-dallas-texas-united-states
"(Miami, FL) Customer Success Manager II, SMB - Dedicated",Customer Success,"Miami, Florida, United States",Not specified,No,Not specified,https://careers.toasttab.com/jobs/miami-fl-customer-success-manager-ii-smb-dedicated-miami-florida-united-states
"(Philadelphia, PA) Customer Success Manager II, SMB - Dedicated",Customer Success,"Philadelphia, Pennsylvania, United States",Not specified,No,Not specified,https://careers.toasttab.com/jobs/philadelphia-pa-customer-success-manager-ii-smb-dedicated-philadelphia-pennsylvania-united-states
"(Washington DC) Customer Success Manager II, SMB - Dedicated",Customer Success,"Washington, District of Columbia, United States",Not specified,No,Not specified,https://careers.toasttab.com/jobs/washington-dc-customer-success-manager-ii-smb-dedicated-washington-district-of-columbia-united-states
Account Operations Advisor,Customer Success,"Boston, Massachusetts, United States",Not specified,No,Not specified,https://careers.toasttab.com/jobs/account-operations-advisor-boston-massachusetts-united-states
Account Operations Advisor,Customer Success,"Omaha, Nebraska, United States",Not specified,No,Not specified,https://careers.toasttab.com/jobs/account-operations-advisor-omaha-nebraska-united-states
"Associate Product Manager, Support AI",Engineering,"Remote, United States",Not specified,Yes,Not specified,https://careers.toasttab.com/jobs/associate-product-manager-support-ai-remote-united-states
"Associate, Corporate Tax",Finance,"Bengaluru, Karnataka, India",Not specified,No,Not specified,https://careers.toasttab.com/jobs/associate-corporate-tax-bengaluru-karnataka-india
"Associate, Corporate Tax",Finance,"Chennai, Tamil Nadu, India",Not specified,No,Not specified,https://careers.toasttab.com/jobs/associate-corporate-tax-chennai-tamil-nadu-india
"Associate, Indirect Tax",Finance,"Bengaluru, Karnataka, India",Not specified,No,Not specified,https://careers.toasttab.com/jobs/associate-indirect-tax-bengaluru-karnataka-india
"Associate, Indirect Tax",Finance,"Chennai, Tamil Nadu, India",Not specified,No,Not specified,https://careers.toasttab.com/jobs/associate-indirect-tax-chennai-tamil-nadu-india
"Atlanta, GA District Sales Manager",Sales,"Atlanta, Georgia, United States",Not specified,No,Not specified,https://careers.toasttab.com/jobs/atlanta-ga-district-sales-manager-atlanta-georgia-united-states
"Baton Rouge, LA Territory Account Executive",Sales,"Baton Rouge, Louisiana, United States",Not specified,No,Not specified,https://careers.toasttab.com/jobs/baton-rouge-la-territory-account-executive-baton-rouge-louisiana-united-states-aa41c991-20e9-40c3-a4f3-d02e3f3ad8fd
Bilingual Business Development Representative (Mandarin),Sales,"San Antonio, Texas, United States",Not specified,No,Not specified,https://careers.toasttab.com/jobs/bilingual-business-development-representative-mandarin-san-antonio-texas-united-states
Bilingual Business Development Representative (Mandarin),Sales,"Jacksonville, Florida, United States",Not specified,No,Not specified,https://careers.toasttab.com/jobs/bilingual-business-development-representative-mandarin-jacksonville-florida-united-states
Bilingual Business Development Representative (Mandarin),Sales,"Dallas, Texas, United States",Not specified,No,Not specified,https://careers.toasttab.com/jobs/bilingual-business-development-representative-mandarin-dallas-texas-united-states
Bilingual Business Development Representative (Mandarin),Sales,"Miami, Florida, United States",Not specified,No,Not specified,https://careers.toasttab.com/jobs/bilingual-business-development-representative-mandarin-miami-florida-united-states
Bilingual Business Development Representative (Mandarin),Sales,"Orlando, Florida, United States",Not specified,No,Not specified,https://careers.toasttab.com/jobs/bilingual-business-development-representative-mandarin-orlando-florida-united-states
Bilingual Business Development Representative (Mandarin),Sales,"Cincinnati, Ohio, United States",Not specified,No,Not specified,https://careers.toasttab.com/jobs/bilingual-business-development-representative-mandarin-cincinnati-ohio-united-states
Bilingual Business Development Representative (Mandarin),Sales,"Cleveland, Ohio, United States",Not specified,No,Not specified,https://careers.toasttab.com/jobs/bilingual-business-development-representative-mandarin-cleveland-ohio-united-states
Bilingual Business Development Representative (Mandarin),Sales,"Philadelphia, Pennsylvania, United States",Not specified,No,Not specified,https://careers.toasttab.com/jobs/bilingual-business-development-representative-mandarin-philadelphia-pennsylvania-united-states
Bilingual Business Development Representative (Mandarin),Sales,"Columbus, Ohio, United States",Not specified,No,Not specified,https://careers.toasttab.com/jobs/bilingual-business-development-representative-mandarin-columbus-ohio-united-states
Bilingual Business Development Representative (Mandarin),Sales,"Tampa, Florida, United States",Not specified,No,Not specified,https://careers.toasttab.com/jobs/bilingual-business-development-representative-mandarin-tampa-florida-united-states
Bilingual Business Development Representative (Mandarin),Sales,"Jersey City, New Jersey, United States",Not specified,No,Not specified,https://careers.toasttab.com/jobs/bilingual-business-development-representative-mandarin-jersey-city-new-jersey-united-states
Bilingual Business Development Representative (Mandarin),Sales,"New York, United States",Not specified,No,Not specified,https://careers.toasttab.com/jobs/bilingual-business-development-representative-mandarin-new-york-united-states
Bilingual Business Development Representative (Mandarin),Sales,"Austin, Texas, United States",Not specified,No,Not specified,https://careers.toasttab.com/jobs/bilingual-business-development-representative-mandarin-austin-texas-united-states
Bilingual Business Development Representative (Mandarin),Sales,"Houston, Texas, United States",Not specified,No,Not specified,https://careers.toasttab.com/jobs/bilingual-business-development-representative-mandarin-houston-texas-united-states
Bilingual Hindi Strategic Cuisines Account Executive,Sales,"Boston, Massachusetts, United States",Not specified,No,Not specified,https://careers.toasttab.com/jobs/bilingual-hindi-strategic-cuisines-account-executive-boston-massachusetts-united-states
"Bilingual Mandarin Account Executive - Phoenix, AZ",Sales,"Phoenix, Arizona, United States",Not specified,No,Not specified,https://careers.toasttab.com/jobs/bilingual-mandarin-account-executive-phoenix-az-phoenix-arizona-united-states
"Bilingual Mandarin Houston, TX Strategic Cuisines Account Executive",Sales,"Houston, Texas, United States",Not specified,No,Not specified,https://careers.toasttab.com/jobs/bilingual-mandarin-houston-tx-strategic-cuisines-account-executive-houston-texas-united-states
"Bilingual Mandarin Los Angeles, CA Strategic Cuisines Account Executive",Sales,"Los Angeles, California, United States",Not specified,No,Not specified,https://careers.toasttab.com/jobs/bilingual-mandarin-los-angeles-ca-strategic-cuisines-account-executive-los-angeles-california-united-states
Bilingual Mandarin Strategic Cuisines Account Executive (Northeast),Sales,"Boston, Massachusetts, United States",Not specified,No,Not specified,https://careers.toasttab.com/jobs/bilingual-mandarin-strategic-cuisines-account-executive-northeast-boston-massachusetts-united-states
Bilingual Mandarin Strategic Cuisines Flex Account Executive - West Coast,Sales,United States,Not specified,No,Not specified,https://careers.toasttab.com/jobs/bilingual-mandarin-strategic-cuisines-flex-account-executive-west-coast-united-states
Bilingual Retail Account Executive - Atlanta East,Sales,"Lawrenceville, Georgia, United States",Not specified,No,Not specified,https://careers.toasttab.com/jobs/bilingual-retail-account-executive-atlanta-east-lawrenceville-georgia-united-states
Bilingual Retail Account Executive - Atlanta East,Sales,"Atlanta, Georgia, United States",Not specified,No,Not specified,https://careers.toasttab.com/jobs/bilingual-retail-account-executive-atlanta-east-atlanta-georgia-united-states
"Bilingual Spanish San Bernardino, CA Strategic Cuisines Account Executive",Sales,"San Bernardino, California, United States",Not specified,No,Not specified,https://careers.toasttab.com/jobs/bilingual-spanish-san-bernardino-ca-strategic-cuisines-account-executive-san-bernardino-california-united-states
Bilingual Spanish Strategic Cuisines Territory Account Executive - San Francisco East Bay (Oakland),Sales,"San Francisco, California, United States",Not specified,No,Not specified,https://careers.toasttab.com/jobs/bilingual-spanish-strategic-cuisines-territory-account-executive-san-francisco-east-bay-oakland-san-francisco-california-united-states
Bilingual Thai Strategic Cuisines Account Executive - Northeast,Sales,"Boston, Massachusetts, United States",Not specified,No,Not specified,https://careers.toasttab.com/jobs/bilingual-thai-strategic-cuisines-account-executive-northeast-boston-massachusetts-united-states
Bilingual Vietnamese Strategic Cuisines Account Executive- East Coast,Sales,"Boston, Massachusetts, United States",Not specified,No,Not specified,https://careers.toasttab.com/jobs/bilingual-vietnamese-strategic-cuisines-account-executive-east-coast-boston-massachusetts-united-states
"Bloomington, Indiana Territory Account Executive",Sales,"Bloomington, Indiana, United States",Not specified,No,Not specified,https://careers.toasttab.com/jobs/bloomington-indiana-territory-account-executive-bloomington-indiana-united-states-2e25ea30-c5c7-43d0-bad2-1b02b906bf31
Capital & Onboarding Execution Analyst,Fintech,"Bengaluru, Karnataka, India",Not specified,No,Not specified,https://careers.toasttab.com/jobs/capital-onboarding-execution-analyst-bengaluru-karnataka-india
Central Region Flex Territory Account Executive,Sales,"Kansas City, Missouri, United States",Not specified,No,Not specified,https://careers.toasttab.com/jobs/central-region-flex-territory-account-executive-kansas-city-missouri-united-states
"Cleveland, OH Territory Account Executive",Sales,"Cleveland, Ohio, United States",Not specified,No,Not specified,https://careers.toasttab.com/jobs/cleveland-oh-territory-account-executive-cleveland-ohio-united-states-e6dc8910-ed8e-4a95-a511-c2d5212d5ae7
"Counsel, International Product",Legal,"London, England, United Kingdom",Not specified,No,Not specified,https://careers.toasttab.com/jobs/counsel-international-product-london-england-united-kingdom
"Counsel, International Product",Legal,"Dublin, County Dublin, Ireland",Not specified,No,Not specified,https://careers.toasttab.com/jobs/counsel-international-product-dublin-county-dublin-ireland
"Counsel, International Product",Legal,"Toronto, Ontario, Canada",Not specified,No,Not specified,https://careers.toasttab.com/jobs/counsel-international-product-toronto-ontario-canada
"Danbury, CT Territory Account Executive",Sales,"Danbury, Connecticut, United States",Not specified,No,Not specified,https://careers.toasttab.com/jobs/danbury-ct-territory-account-executive-danbury-connecticut-united-states
Director of Lifecycle Marketing,Marketing,"Boston, Massachusetts, United States",Not specified,No,Not specified,https://careers.toasttab.com/jobs/director-of-lifecycle-marketing-boston-massachusetts-united-states
"Director of Product Management, Card Readers",Product,"Dublin, County Dublin, Ireland",Not specified,No,Not specified,https://careers.toasttab.com/jobs/director-of-product-management-card-readers-dublin-county-dublin-ireland-31926514-2208-4128-87f8-020481e1735e
"Director of Product Management, Risk & Fraud",Product,"Bengaluru, Karnataka, India",Not specified,No,Not specified,https://careers.toasttab.com/jobs/director-of-product-management-risk-fraud-bengaluru-karnataka-india
"Director, Fintech Compliance",Legal,"Remote, United States",Not specified,Yes,Not specified,https://careers.toasttab.com/jobs/director-fintech-compliance-remote-united-states-06a288f6-5fa2-4747-ae38-68980e8e7e7a
"Director, FinTech Counsel",Legal,,Not specified,No,Not specified,https://careers.toasttab.com/jobs/director-fintech-counsel
"Director, Internal Enablement, Customer Success",,"Boston, Massachusetts, United States",Not specified,No,Not specified,https://careers.toasttab.com/jobs/director-internal-enablement-customer-success-boston-massachusetts-united-states
"Director, Organic Growth",Marketing,"Boston, Massachusetts, United States",Not specified,No,Not specified,https://careers.toasttab.com/jobs/director-organic-growth-boston-massachusetts-united-states
"Director, Talent Acquisition Operations",People & Places,"San Francisco, California, United States",Not specified,No,Not specified,https://careers.toasttab.com/jobs/director-talent-acquisition-operations-san-francisco-california-united-states
East Coast Mandarin Strategic Cuisines Inside Account Executive,Sales,"Boston, Massachusetts, United States",Not specified,No,Not specified,https://careers.toasttab.com/jobs/east-coast-mandarin-strategic-cuisines-inside-account-executive-boston-massachusetts-united-states
Eastern TN Territory Account Executive,Sales,"Tennessee, United States",Not specified,No,Not specified,https://careers.toasttab.com/jobs/eastern-tn-territory-account-executive-tennessee-united-states-b21964de-a0f1-4f02-b40a-12bf0f418a82
"El Segundo, CA Territory Account Executive",Sales,"El Segundo, California, United States",Not specified,No,Not specified,https://careers.toasttab.com/jobs/el-segundo-ca-territory-account-executive-el-segundo-california-united-states-4c087271-1345-42c0-adde-c06689b89449
Escalation Engineer II,Engineering,"Dublin, County Dublin, Ireland",Not specified,No,Not specified,https://careers.toasttab.com/jobs/escalation-engineer-ii-dublin-county-dublin-ireland
"Fairfield, CT Territory Account Executive",Sales,"Fairfield, Connecticut, United States",Not specified,No,Not specified,https://careers.toasttab.com/jobs/fairfield-ct-territory-account-executive-fairfield-connecticut-united-states-3280adc4-36ae-43bb-8003-e363197b49f4
Field Implementation Technician - Brisbane,Customer Success,"Brisbane, Queensland, Australia",Not specified,No,Not specified,https://careers.toasttab.com/jobs/field-implementation-technician-brisbane-brisbane-queensland-australia
Field Implementation Technician - Melbourne,Customer Success,"Melbourne, Victoria, Australia",Not specified,No,Not specified,https://careers.toasttab.com/jobs/field-implementation-technician-melbourne-melbourne-victoria-australia
Field Implementation Technician - Sydney,Customer Success,"Sydney, New South Wales, Australia",Not specified,No,Not specified,https://careers.toasttab.com/jobs/field-implementation-technician-sydney-sydney-new-south-wales-australia
FinTech Product Counsel,Legal,"Remote, United States",Not specified,Yes,Not specified,https://careers.toasttab.com/jobs/fintech-product-counsel-remote-united-states
Flex Growth Account Executive,Sales,"Miami, Florida, United States",Not specified,No,Not specified,https://careers.toasttab.com/jobs/flex-growth-account-executive-miami-florida-united-states
Flex Growth Account Executive,Sales,"Washington, District of Columbia, United States",Not specified,No,Not specified,https://careers.toasttab.com/jobs/flex-growth-account-executive-washington-district-of-columbia-united-states
Flex Growth Account Executive,Sales,"San Francisco, California, United States",Not specified,No,Not specified,https://careers.toasttab.com/jobs/flex-growth-account-executive-san-francisco-california-united-states
Flex Growth Account Executive,Sales,"Miami, Florida, United States",Not specified,No,Not specified,https://careers.toasttab.com/jobs/flex-growth-account-executive-miami-florida-united-states-c73c78f7-e770-4932-96b3-6000b7bbade0
Flex Growth Account Executive,Sales,"Portland, Oregon, United States",Not specified,No,Not specified,https://careers.toasttab.com/jobs/flex-growth-account-executive-portland-oregon-united-states
Flex Growth Account Executive,Sales,"Seattle, Washington, United States",Not specified,No,Not specified,https://careers.toasttab.com/jobs/flex-growth-account-executive-seattle-washington-united-states-2b687194-2ab3-4dfc-8925-cb17b2004c76
Flex Growth Account Executive,Sales,"Seattle, Washington, United States",Not specified,No,Not specified,https://careers.toasttab.com/jobs/flex-growth-account-executive-seattle-washington-united-states
Flex Growth Account Executive,Sales,"Los Angeles, California, United States",Not specified,No,Not specified,https://careers.toasttab.com/jobs/flex-growth-account-executive-los-angeles-california-united-states-e0362543-379a-4750-91a5-e2423b791c4e
Flex Growth Account Executive,Sales,"Atlanta, Georgia, United States",Not specified,No,Not specified,https://careers.toasttab.com/jobs/flex-growth-account-executive-atlanta-georgia-united-states-473b96e5-d3ec-4a22-baf6-945a65af2209
"Flex Strategic Cuisine Territory Account Executive (Spanish/Bilingual)-Central, USA",Sales,"Lansing, Michigan, United States",Not specified,No,Not specified,https://careers.toasttab.com/jobs/flex-strategic-cuisine-territory-account-executive-spanish-bilingual-central-usa-lansing-michigan-united-states
"Flex Strategic Cuisine Territory Account Executive (Spanish/Bilingual)-East Coast, USA",Sales,"Raleigh, North Carolina, United States",Not specified,No,Not specified,https://careers.toasttab.com/jobs/flex-strategic-cuisine-territory-account-executive-spanish-bilingual-east-coast-usa-raleigh-north-carolina-united-states
"Flex Strategic Cuisine Territory Account Executive (Spanish/Bilingual), South Central, USA",Sales,"Oklahoma City, Oklahoma, United States",Not specified,No,Not specified,https://careers.toasttab.com/jobs/flex-strategic-cuisine-territory-account-executive-spanish-bilingual-south-central-usa-oklahoma-city-oklahoma-united-states
"Flex Strategic Cuisine Territory Account Executive (Spanish/Bilingual), West Coast, USA",Sales,"San Francisco, California, United States",Not specified,No,Not specified,https://careers.toasttab.com/jobs/flex-strategic-cuisine-territory-account-executive-spanish-bilingual-west-coast-usa-san-francisco-california-united-states
Flex Territory Account Executive (Mid-Atlantic Region),Sales,"Washington, District of Columbia, United States",Not specified,No,Not specified,https://careers.toasttab.com/jobs/flex-territory-account-executive-mid-atlantic-region-washington-district-of-columbia-united-states
"Fort Wayne, IN - Territory Account Executive",Sales,"Fort Wayne, Indiana, United States",Not specified,No,Not specified,https://careers.toasttab.com/jobs/fort-wayne-in-territory-account-executive-fort-wayne-indiana-united-states-1f5e36bb-5697-46c7-a8eb-73e03aa1e925
"Greater Philadelphia, PA Territory Account Executive",Sales,"Philadelphia, Pennsylvania, United States",Not specified,No,Not specified,https://careers.toasttab.com/jobs/greater-philadelphia-pa-territory-account-executive-philadelphia-pennsylvania-united-states
"Green Bay, WI Territory Account Executive",Sales,"Green Bay, Wisconsin, United States",Not specified,No,Not specified,https://careers.toasttab.com/jobs/green-bay-wi-territory-account-executive-green-bay-wisconsin-united-states-7f67155a-b474-45f6-8827-bfd15fb48769
"Greenwood, Indiana Territory Account Executive",Sales,"Greenwood, Indiana, United States",Not specified,No,Not specified,https://careers.toasttab.com/jobs/greenwood-indiana-territory-account-executive-greenwood-indiana-united-states
Growth Account Executive,Sales,"Providence, Rhode Island, United States",Not specified,No,Not specified,https://careers.toasttab.com/jobs/growth-account-executive-providence-rhode-island-united-states
Growth Account Executive,Sales,"Pawtucket, Rhode Island, United States",Not specified,No,Not specified,https://careers.toasttab.com/jobs/growth-account-executive-pawtucket-rhode-island-united-states
Growth Account Executive,Sales,"Boston, Massachusetts, United States",Not specified,No,Not specified,https://careers.toasttab.com/jobs/growth-account-executive-boston-massachusetts-united-states-f6652726-5801-4b4c-97af-77f7ea729ac3
Growth Flex Account Executive,Sales,"Phoenix, Arizona, United States",Not specified,No,Not specified,https://careers.toasttab.com/jobs/growth-flex-account-executive-phoenix-arizona-united-states
Growth Flex Account Executive,Sales,"San Diego, California, United States",Not specified,No,Not specified,https://careers.toasttab.com/jobs/growth-flex-account-executive-san-diego-california-united-states
"GTM Engineer, Marketing Operations",Marketing,"Remote, United States",Not specified,Yes,Not specified,https://careers.toasttab.com/jobs/gtm-engineer-marketing-operations-remote-united-states
Inside Sales Executive,Sales,,Not specified,No,Not specified,https://careers.toasttab.com/jobs/inside-sales-executive-b5d18f61-95f3-46c4-a003-e0543fd6ae31
Internal Communications Manager,Marketing,"New York, United States",Not specified,No,Not specified,https://careers.toasttab.com/jobs/internal-communications-manager-new-york-united-states
Internal Communications Manager,Marketing,"Boston, Massachusetts, United States",Not specified,No,Not specified,https://careers.toasttab.com/jobs/internal-communications-manager-boston-massachusetts-united-states
Internal Communications Manager,Marketing,"San Francisco, California, United States",Not specified,No,Not specified,https://careers.toasttab.com/jobs/internal-communications-manager-san-francisco-california-united-states
"Jersey City, NJ Mandarin Strategic Cuisines Account Executive",Sales,"Jersey City, New Jersey, United States",Not specified,No,Not specified,https://careers.toasttab.com/jobs/jersey-city-nj-mandarin-strategic-cuisines-account-executive-jersey-city-new-jersey-united-states
"Joliet, IL - SMB Territory Account Executive",Sales,"Joliet, Illinois, United States",Not specified,No,Not specified,https://careers.toasttab.com/jobs/joliet-il-smb-territory-account-executive-joliet-illinois-united-states
"Kansas City, MO Territory Account Executive",Sales,"Kansas City, Missouri, United States",Not specified,No,Not specified,https://careers.toasttab.com/jobs/kansas-city-mo-territory-account-executive-kansas-city-missouri-united-states-4ea73e32-10c6-487d-8b64-f7b5a9d533f7
LA West/North - Bilingual Spanish - Strategic Cuisines Account Executive,Sales,"Los Angeles, California, United States",Not specified,No,Not specified,https://careers.toasttab.com/jobs/la-west-north-bilingual-spanish-strategic-cuisines-account-executive-los-angeles-california-united-states
"Lake Oswego, OR Territory Account Executive",Sales,"Lake Oswego, Oregon, United States",Not specified,No,Not specified,https://careers.toasttab.com/jobs/lake-oswego-or-territory-account-executive-lake-oswego-oregon-united-states-971b156a-c822-4ab4-a016-4df11e102333
"Las Vegas, Mandarin Strategic Cuisines Account Executive",Sales,"Las Vegas, Nevada, United States",Not specified,No,Not specified,https://careers.toasttab.com/jobs/las-vegas-mandarin-strategic-cuisines-account-executive-las-vegas-nevada-united-states-5bd39aac-bc67-4ac0-8087-dfb60284093f
"Las Vegas, NV Flex Territory Account Executive",Sales,"Las Vegas, Nevada, United States",Not specified,No,Not specified,https://careers.toasttab.com/jobs/las-vegas-nv-flex-territory-account-executive-las-vegas-nevada-united-states
Lead Fraud & Risk Strategy Analyst,Fintech,,Not specified,No,Not specified,https://careers.toasttab.com/jobs/lead-fraud-risk-strategy-analyst
Lead Systems Developer NetSuite,Enterprise Tech,"Remote, United States",Not specified,Yes,Not specified,https://careers.toasttab.com/jobs/lead-systems-developer-netsuite-remote-united-states
Lead Technical Compliance Analyst,Product,"Dublin, County Dublin, Ireland",Not specified,No,Not specified,https://careers.toasttab.com/jobs/lead-technical-compliance-analyst-dublin-county-dublin-ireland-c80bdecd-cc27-4807-a241-4a44f96d1b32
Lead Technical Governance Analyst,Product,,Not specified,No,Not specified,https://careers.toasttab.com/jobs/lead-technical-governance-analyst
"Long Island, NY - Strategic Cuisines Territory Account Executive",Sales,"Long Island, New York, United States",Not specified,No,Not specified,https://careers.toasttab.com/jobs/long-island-ny-strategic-cuisines-territory-account-executive-long-island-new-york-united-states
"Los Angeles, CA Territory Account Executive",Sales,"Los Angeles, California, United States",Not specified,No,Not specified,https://careers.toasttab.com/jobs/los-angeles-ca-territory-account-executive-los-angeles-california-united-states-dc420151-6044-4c87-ac82-8b5cc5f4bc3a
"Manager II, Customer Care - Escalations",Customer Success,"Boston, Massachusetts, United States",Not specified,No,Not specified,https://careers.toasttab.com/jobs/manager-ii-customer-care-escalations-boston-massachusetts-united-states
"Manager, Social Media & Culture",Marketing,,Not specified,No,Not specified,https://careers.toasttab.com/jobs/manager-social-media-culture
