title,department,openings,locations,all_locations,regions,remote_available
People Support Specialist,Not specified,2,IND.Pune,IND.Pune,Not specified,No
Account Executive - Customer Base LE - FSI,Not specified,1,2 Locations,2 Locations,Not specified,No
"Account Executive Large Enterprise, Net New (Retail, Hospitality, and Transportation)",Not specified,1,9 Locations,9 Locations,Not specified,No
"Director, Enterprise Identity",Not specified,1,"USA, VA, McLean","USA, VA, McLean",Not specified,No
"Director, Field Services",Not specified,1,"USA, CA, Remote","USA, CA, Remote",Not specified,Yes
"Director, Marketing Campaigns & Programs (APJ)",Not specified,1,"Australia, NSW, North Sydney","Australia, NSW, North Sydney",Not specified,No
Enterprise Architect,Not specified,1,4 Locations,4 Locations,Not specified,No
Financial System Implementation Consultant,Not specified,1,Costa Rica,Costa Rica,Not specified,No
Functional Consultant -Financials - Consultant fonctionnel ou consultante fonctionnelle – Gestion financière,Not specified,1,6 Locations,6 Locations,Not specified,No
HCM Lead Functional Consultant - META,Not specified,1,UAE.Dubai,UAE.Dubai,Not specified,No
Human Capital Management Solution Consultant,Not specified,1,5 Locations,5 Locations,Not specified,No
"Large Enterprise Account Executive, Customer Base - Manufacturing",Not specified,1,4 Locations,4 Locations,Not specified,No
"Large Enterprise Account Executive, Net New- MFG, TM & PS",Not specified,1,11 Locations,11 Locations,Not specified,No
"Major Account Executive, Net New (Retail & Hospitality)",Not specified,1,10 Locations,10 Locations,Not specified,No
"Manager, Support Platform Engineering",Not specified,1,"Poland, Warsaw","Poland, Warsaw",Not specified,No
"Manager, Technical Project Implementation Team",Not specified,1,Costa Rica,Costa Rica,Not specified,No
"Manager, Technology Control & Process",Not specified,1,2 Locations,2 Locations,Not specified,No
P&P AI Technology Program Manager,Not specified,1,"USA, GA, Atlanta","USA, GA, Atlanta",Not specified,No
P3 Software Development Engineer in Test,Not specified,1,IND.Chennai,IND.Chennai,Not specified,No
Payroll Analyst,Not specified,1,"USA, GA, Atlanta","USA, GA, Atlanta",Not specified,No
"Principal HCM Consultant, State & Local Government",Not specified,1,USA Remote,USA Remote,Not specified,Yes
Product Manager,Not specified,1,IND.Chennai,IND.Chennai,Not specified,No
Regional Sales Director - Customer Base - FSI,Not specified,1,2 Locations,2 Locations,Not specified,No
Senior Associate Customer Success Manager - Paradox,Not specified,1,2 Locations,2 Locations,Not specified,No
Senior Financial Implementation Consultant (Healthcare),Not specified,1,62 Locations,62 Locations,Not specified,No
"Senior Product Manager, Authentication",Not specified,1,IND.Chennai,IND.Chennai,Not specified,No
Senior/Principal Machine Learning Engineer,Not specified,1,2 Locations,2 Locations,Not specified,No
Software Development Engineer (Java),Not specified,1,IND.Chennai,IND.Chennai,Not specified,No
Software Development Engineer-Adobe Experience Manager,Not specified,1,IND.Pune,IND.Pune,Not specified,No
Sr Cloud and Cloud Engineering III  - US Federal,Not specified,1,"USA, VA, McLean","USA, VA, McLean",Not specified,No
Sr Engagement Manager,Not specified,1,"Italy, Milan","Italy, Milan",Not specified,No
Sr Functional Consultant - Payroll & Time Tracking,Not specified,1,3 Locations,3 Locations,Not specified,No
Sr Software Development Engineer for AI,Not specified,1,"Canada, ON, Toronto","Canada, ON, Toronto",Not specified,No
Sr. Associate Event Coordinator,Not specified,1,"USA, CA, Pleasanton","USA, CA, Pleasanton",Not specified,No
Sr. Associate People Support Specialist,Not specified,1,IND.Pune,IND.Pune,Not specified,No
"Sr. Engagement Manager, AI Solutions Delivery",Not specified,1,7 Locations,7 Locations,Not specified,No
Technical Implementation Success Partner (Production Readiness Manager),Not specified,1,Costa Rica,Costa Rica,Not specified,No
Technical Product Support Engineer,Not specified,1,IND.Pune,IND.Pune,Not specified,No
Technical Program Manager,Not specified,1,Costa Rica,Costa Rica,Not specified,No
